{
  "id": "src-6d29e5e55ff715de",
  "ingested_at": "2026-07-19T16:14:43+00:00",
  "kind": "document",
  "media_type": "text/plain",
  "original_name": "reponses-delia-questionnaire-2026-07-19.txt",
  "original_uri": null,
  "sha256": "e769342f9cbf4a7b0eff1aa3022b114b655b4a849f360cf358742c02315b8ac3",
  "size_bytes": 18608
}
