{
  "id": "src-7b00300a5a39f5be",
  "ingested_at": "2026-07-20T14:45:25+00:00",
  "kind": "document",
  "media_type": "text/plain",
  "original_name": "precision-perimetre-entrepreneurial-bleu-rossignol-2026-07-20.txt",
  "original_uri": null,
  "sha256": "7559f2ac9f9dcd87efa0f0daaa7422257d5cf5ec01c4bbdc306e4d4a99bb7316",
  "size_bytes": 979
}
